<?xml version="1.0" encoding="UTF-8"?>
<!DOCTYPE grading_result SYSTEM "grading_result.dtd">
<grading_result>
<id>220e8400-e29b-41d4-a716-44665544000c</id>
<assessment_id>660e8400-e29b-41d4-a716-446655440001</assessment_id>
<phq9_total_score>5</phq9_total_score>
<phq9_severity>minimal</phq9_severity>
<gad7_total_score>5</gad7_total_score>
<gad7_severity>minimal</gad7_severity>
<risk_level>low</risk_level>
<graded_at>2026-04-09T10:00:00Z</graded_at>
<created_at>2026-04-09T10:00:00Z</created_at>
<updated_at>2026-04-09T10:00:00Z</updated_at>
</grading_result>
